Film,Omschrijving,Genres
The Iron Giant,A young boy befriends a giant robot from outer space that a paranoid government agent wants to destroy.,"Animation, Action, Adventure"
Stalker,A guide leads two men through an area known as the Zone to find a room that grants wishes.,"Drama, Sci-Fi"
Before Sunset,"Nine years after Jesse and Celine first met, they encounter each other again on the French leg of Jesse's book tour.","Drama, Romance"
The Seventh Seal,"A knight returning to Sweden after the Crusades seeks answers about life, death, and the existence of God as he plays chess against the Grim Reaper during the Black Plague.","Drama, Fantasy"
Ben-Hur,"After a Jewish prince is betrayed and sent into slavery by a Roman friend in 1st-century Jerusalem, he regains his freedom and comes back for revenge.","Adventure, Drama"
Wild Tales,Six short stories that explore the extremities of human behavior involving people in distress.,"Comedy, Drama, Thriller"
Network,"A television network cynically exploits a deranged former anchor's ravings and revelations about the news media for its own profit, but finds that his message may be difficult to control.",Drama
On the Waterfront,"An ex-prize fighter turned New Jersey longshoreman struggles to stand up to his corrupt union bosses, including his older brother, as he starts to connect with the grieving sister of one of the syndicate's victims.","Crime, Drama, Thriller"
In the Name of the Father,A man's coerced confession to an I.R.A. bombing he did not commit results in the imprisonment of his father as well. An English lawyer fights to free them.,"Biography, Crime, Drama"
Cool Hand Luke,"A laid-back Southern man is sentenced to two years in a rural prison, but refuses to conform.","Crime, Drama"
The Third Man,"Pulp novelist Holly Martins travels to shadowy, postwar Vienna, only to find himself investigating the mysterious death of an old friend, Harry Lime.","Film-Noir, Mystery, Thriller"
Persona,A nurse is put in charge of a mute actress and finds that their personae are melding together.,"Drama, Thriller"
Amores Perros,"A horrific car accident connects three stories, each involving characters dealing with loss, regret, and life's harsh realities, all in the name of love.","Drama, Thriller"
A Silent Voice: The Movie,"A young man is ostracized by his classmates after he bullies a deaf girl to the point where she moves away. Years later, he sets off on a path for redemption.","Animation, Drama"
The Bridge on the River Kwai,"British POWs are forced to build a railway bridge across the river Kwai for their Japanese captors in occupied Burma, not knowing that the allied forces are planning a daring commando raid through the jungle to destroy it.","Adventure, Drama, War"
Hotel Rwanda,"Paul Rusesabagina, a hotel manager, houses over a thousand Tutsi refugees during their struggle against the Hutu militia in Rwanda, Africa.","Biography, Drama, History"
Rebecca,A self-conscious woman juggles adjusting to her new role as an aristocrat's wife and avoiding being intimidated by his first wife's spectral presence.,"Drama, Film-Noir, Mystery"
Neon Genesis Evangelion: The End of Evangelion,Concurrent theatrical ending of the TV series Neon Genesis Evangelion (1995).,"Animation, Action, Drama"
Paper Moon,"During the Great Depression, a con man finds himself saddled with a young girl who may or may not be his daughter, and the two forge an unlikely partnership.","Comedy, Crime, Drama"
All Quiet on the Western Front,"A German youth eagerly enters World War I, but his enthusiasm wanes as he gets a firsthand view of the horror.","Drama, War"
Mary and Max,"A tale of friendship between two unlikely pen pals: Mary, a lonely, eight-year-old girl living in the suburbs of Melbourne, and Max, a forty-four-year old, severely obese man living in New York.","Animation, Comedy, Drama"
The Man Who Shot Liberty Valance,A senator returns to a Western town for the funeral of an old friend and tells the story of his origins.,"Drama, Western"
The Celebration,"At Helge's 60th birthday party, some unpleasant family truths are revealed.",Drama
The Best Years of Our Lives,"Three World War II veterans, two of them traumatized or disabled, return home to the American midwest to discover that they and their families have been irreparably changed.","Drama, Romance, War"
PK,An alien on Earth loses the only device he can use to communicate with his spaceship. His innocent nature and child-like questions force the country to evaluate the impact of religious views on people.,"Comedy, Drama, Sci-Fi"
Farewell My Concubine,Two boys meet at an opera training school in Peking in 1924. Their resulting friendship will span nearly 70 years and endure some of the most troublesome times in China's history.,"Drama, Music, Romance"
Underground,"Two underground black marketeers, Marko and Blacky, sell weapons to the Communist resistance in wartime Belgrade, living the good life along the way.","Comedy, Drama, Fantasy"
The Red Shoes,A young ballet dancer is torn between the man she loves and her pursuit to become a prima ballerina.,"Drama, Music, Romance"
The Grapes of Wrath,"An Oklahoma family, driven off their farm by the poverty and hopelessness of the Dust Bowl, joins the westward migration to California, suffering the misfortunes of the homeless in the Great Depression.",Drama
It Happened One Night,"A renegade reporter trailing a young runaway heiress for a big story joins her on a bus heading from Florida to New York, and they end up stuck with each other when the bus leaves them behind at one of the stops.","Comedy, Romance"
The Battle of Algiers,"In the 1950s, fear and violence escalate as the people of Algiers fight for independence from the French government.","Drama, War"
Fanny and Alexander,"Two young Swedish children in the 1900s experience the many comedies and tragedies of their lively and affectionate theatrical family, the Ekdahls.",Drama
White Heat,A psychopathic criminal with a mother complex makes a daring break from prison and leads his old gang in a chemical plant payroll heist.,"Action, Crime, Drama"
A Woman Under the Influence,"Although wife and mother Mabel is loved by her husband Nick, her mental illness places a strain on the marriage.","Drama, Romance"
Tokyo Story,"An old couple visit their children and grandchildren in the city, but receive little attention.",Drama
The 400 Blows,"A young boy, left without attention, delves into a life of petty crime.","Crime, Drama"
Wild Strawberries,"After living a life marked by coldness, an aging professor is forced to confront the emptiness of his existence.","Drama, Romance"
Three Colors: Red,A model discovers a retired judge is keen on invading people's privacy.,"Drama, Mystery, Romance"
OMG: Oh My God!,A shopkeeper takes God to court when his shop is destroyed by an earthquake.,"Comedy, Drama, Fantasy"
Diabolique,The wife and mistress of a loathed school principal plan to murder him with what they believe is the perfect alibi.,"Crime, Drama, Horror"
Yi Yi,Each member of a middle-class Taipei family seeks to reconcile past and present relationships within their daily lives.,"Drama, Romance"
Bajrangi Bhaijaan,An Indian man with a magnanimous heart takes a young mute Pakistani girl back to her homeland to reunite her with her family.,"Action, Adventure, Comedy"
Inherit the Wind,"Based on a real-life case in 1925, two great lawyers argue the case for and against a Tennessee science teacher accused of the crime of teaching evolution.","Biography, Drama, History"
The Gold Rush,"A prospector goes to the Klondike during the 1890s gold rush in hopes of making his fortune, and is smitten with a girl he sees in a dance hall.","Adventure, Comedy, Drama"
The Passion of Joan of Arc,"In 1431, Jeanne d'Arc is placed on trial on charges of heresy. The ecclesiastical jurists attempt to force Jeanne to recant her claims of holy visions.","Biography, Drama, History"
Andrei Rublev,"The life, times and afflictions of the fifteenth-century Russian iconographer St. Andrei Rublev.","Biography, Drama, History"
Mr. Smith Goes to Washington,"A naive youth leader is appointed to fill a vacancy in the U.S. Senate. His idealistic plans promptly collide with corruption at home and subterfuge from his hero in Washington, but he tries to forge ahead despite attacks on his character.","Comedy, Drama"
Winter Sleep,A hotel owner and landlord in a remote Turkish village deals with conflicts within his family and a tenant behind on his rent.,Drama
Lagaan: Once Upon a Time in India,The people of a small village in Victorian India stake their future on a game of cricket against their ruthless British rulers.,"Drama, Musical, Sport"
The General,"After being rejected by the Confederate military, not realizing it was due to his crucial civilian role, an engineer must single-handedly recapture his beloved locomotive after it is seized by Union spies and return it through enemy lines.","Action, Adventure, Comedy"
Munna Bhai M.B.B.S.,A gangster sets out to fulfill his father's dream of becoming a doctor.,"Comedy, Drama"
Sunrise,"A sophisticated city woman seduces a farmer and convinces him to murder his wife and join her in the city, but he ends up rekindling his romance with his wife when he changes his mind at the last moment.","Drama, Romance"
The Hidden Fortress,"Lured by gold, two greedy peasants unknowingly escort a princess and her general across enemy lines.","Action, Adventure, Drama"
Wolf Children,"After her werewolf lover unexpectedly dies in an accident while hunting for food for their children, a young woman must find ways to raise the werewolf son and daughter that she had with him while keeping their trait hidden from society.","Animation, Drama, Family"
Throne of Blood,"A war-hardened general, egged on by his ambitious wife, works to fulfill a prophecy that he would become lord of Spider's Web Castle.",Drama
The Message,This epic historical drama chronicles the life and times of Prophet Muhammad and serves as an introduction to early Islamic history.,"Biography, Drama, History"
Nights of Cabiria,A waifish prostitute wanders the streets of Rome looking for true love but finds only heartbreak.,Drama
Raise the Red Lantern,"A young woman becomes the fourth wife of a wealthy lord, and must learn to live with the strict rules and tensions within the household.","Drama, Romance"
Autumn Sonata,"A devoted wife is visited by her mother, a successful concert pianist who had little time for her when she was young.","Drama, Music"
Rififi,"Four men plan a technically perfect crime, but the human element intervenes...","Crime, Drama, Thriller"
Barfi!,Three young people learn that love can neither be defined nor contained by society's definition of normal and abnormal.,"Comedy, Drama, Romance"
The Grand Illusion,"During WWI, two French soldiers are captured and imprisoned in a German P.O.W. camp. Several escape attempts follow until they are eventually sent to a seemingly inescapable fortress.","Drama, War"
Talvar,An experienced investigator confronts several conflicting theories about the perpetrators of a violent double homicide.,"Crime, Drama, Mystery"
Article 15,"In the rural heartlands of India, an upright police officer sets out on a crusade against violent caste-based crimes and discrimination.","Crime, Drama, Mystery"
Ace in the Hole,"A frustrated former big-city journalist now stuck working for an Albuquerque newspaper exploits a story about a man trapped in a cave to rekindle his career, but the situation quickly escalates into an out-of-control circus.","Drama, Film-Noir"
Masaan,"Along India's Ganges River, four people face prejudice, a strict moral code and a punishing caste system as they confront personal tragedies.",Drama
Udaan,"Expelled from his school, a 16-year old boy returns home to his abusive and oppressive father.",Drama
Jean de Florette,A greedy landowner and his backward nephew conspire to block the only water source for an adjoining property in order to bankrupt the owner and force him to sell.,"Comedy, Drama"
Rang De Basanti,"The story of six young Indians who assist an English woman to film a documentary on the freedom fighters from their past, and the events that lead them to relive the long-forgotten saga of freedom.","Comedy, Crime, Drama"
Tangerines,"In 1992, war rages in Abkhazia, a breakaway region of Georgia. An Estonian man, Ivo, has decided to stay behind and harvest his crops of tangerines. In a bloody conflict at his door, a wounded man is left behind, and Ivo takes him in.","Drama, War"
Pink,"When three young women are implicated in a crime, a retired lawyer steps forward to help them clear their names.","Crime, Drama, Thriller"
Viridiana,"Viridiana, a young nun about to take her final vows, pays a visit to her widowed uncle at the request of her Mother Superior.",Drama
Time of the Gypsies,"In this luminous tale set in the area around Sarajevo and in Italy, Perhan, an engaging young Romany (gypsy) with telekinetic powers, is seduced by the quick-cash world of petty crime, which threatens to destroy him and those he loves.","Comedy, Crime, Drama"
Sholay,"After his family is murdered by a notorious and ruthless bandit, a former police officer enlists the services of two outlaws to capture the bandit.","Action, Adventure, Comedy"
Dil Chahta Hai,"Three inseparable childhood friends are just out of college. Nothing comes between them - until they each fall in love, and their wildly different approaches to relationships creates tension.","Comedy, Drama, Romance"
The Bandit,"Baran the Bandit, released from prison after 35 years, searches for vengeance and his lover.","Crime, Drama, Thriller"
The Circus,The Tramp finds work and the girl of his dreams at a circus.,"Comedy, Family, Romance"
Chak De! India,"Kabir Khan, the coach of the Indian Women's National Hockey Team, dreams of making his all-girls team emerge victorious against all odds.","Drama, Family, Sport"
A Wednesday,A retiring police officer reminisces about the most astounding day of his career. About a case that was never filed but continues to haunt him in his memories - the case of a man and a Wednesday.,"Action, Crime, Drama"
Queen,A Delhi girl from a traditional family sets out on a solo honeymoon after her marriage gets cancelled.,"Adventure, Comedy, Drama"
Kahaani,"A pregnant woman's search for her missing husband takes her from London to Kolkata, but everyone she questions denies having ever met him.","Mystery, Thriller"
Hera Pheri,"Three unemployed men look for answers to all their money problems - but when their opportunity arrives, will they know what to do with it?","Action, Comedy, Crime"
Black,"The cathartic tale of a young woman who can't see, hear, or speak, and the teacher who brings a ray of light into her dark world.",Drama
Everything's Gonna Be Great,"When Altan swipes prescription drugs from his brother Nuri's pharmacy, they soon find themselves on a dangerous but funny road trip to get rid of the stuff and escape the mafiosi Altan ...                See full summary »","Comedy, Drama, Thriller"
Sarfarosh,"After his brother is killed and father severely injured by terrorists, a young med student quits his studies to join the Indian Police Service to wipe out the terrorists.","Action, Crime, Drama"
Anand,"The story of a terminally ill man who wishes to live life to the fullest before the inevitable occurs, as told by his best friend.","Drama, Musical"
Killers of the Flower Moon,"When oil is discovered in 1920s Oklahoma under Osage Nation land, the Osage people are murdered one by one - until the FBI steps in to unravel the mystery.","Crime, Drama, History"
Past Lives,"Nora and Hae Sung, two deeply connected childhood friends, are wrested apart after Nora's family emigrates from South Korea. Twenty years later, they are reunited for one fateful week as they confront notions of love and destiny.","Drama, Romance"
Dune,A noble family becomes embroiled in a war for control over the galaxy's most valuable asset while its heir becomes troubled by visions of a dark future.,"Action, Adventure, Drama"
Blade Runner 2049,"Young Blade Runner K's discovery of a long-buried secret leads him to track down former Blade Runner Rick Deckard, who's been missing for thirty years.","Action, Drama, Mystery"
The Princess Bride,"A bedridden boy's grandfather reads him the story of a farmboy-turned-pirate who encounters numerous obstacles, enemies and allies in his quest to be reunited with his true love.","Adventure, Comedy, Family"
Black Swan,"Nina is a talented but unstable ballerina on the verge of stardom. Pushed to the breaking point by her artistic director and a seductive rival, Nina's grip on reality slips, plunging her into a waking nightmare.","Drama, Thriller"
Donnie Darko,"After narrowly escaping a bizarre accident, a troubled teenager is plagued by visions of a man in a large rabbit suit who manipulates him to commit a series of crimes.","Drama, Mystery, Sci-Fi"
La La Land,"While navigating their careers in Los Angeles, a pianist and an actress fall in love while attempting to reconcile their aspirations for the future.","Comedy, Drama, Music"
The Revenant,A frontiersman on a fur trading expedition in the 1820s fights for survival after being mauled by a bear and left for dead by members of his own hunting team.,"Action, Adventure, Drama"
Deadpool,"A wisecracking mercenary gets experimented on and becomes immortal yet hideously scarred, and sets out to track down the man who ruined his looks.","Action, Comedy"
Guardians of the Galaxy,A group of intergalactic criminals must pull together to stop a fanatical warrior with plans to purge the universe.,"Action, Adventure, Comedy"
Her,"In a near future, a lonely writer develops an unlikely relationship with an operating system designed to meet his every need.","Drama, Romance, Sci-Fi"
Sin City,"An exploration of the dark and miserable Basin City and three of its residents, all of whom are caught up in violent corruption.","Crime, Thriller"
Casino Royale,"After earning 00 status and a licence to kill, secret agent James Bond sets out on his first mission as 007. Bond must defeat a private banker funding terrorists in a high-stakes game of poker at Casino Royale, Montenegro.","Action, Adventure, Thriller"
The Avengers,Earth's mightiest heroes must come together and learn to fight as a team if they are going to stop the mischievous Loki and his alien army from enslaving humanity.,"Action, Sci-Fi"
The Incredibles,"While trying to lead a quiet suburban life, a family of undercover superheroes are forced into action to save the world.","Animation, Action, Adventure"
The Martian,"An astronaut becomes stranded on Mars after his team assume him dead, and must rely on his ingenuity to find a way to signal to Earth that he is alive and can survive until a potential rescue.","Adventure, Drama, Sci-Fi"
Zootopia,"In a city of anthropomorphic animals, a rookie bunny cop and a cynical con artist fox must work together to uncover a conspiracy.","Animation, Adventure, Comedy"
CODA,"As a CODA (Child of Deaf Adults) Ruby is the only hearing person in her deaf family. When the family's fishing business is threatened, Ruby finds herself torn between pursuing her passion at Berklee College of Music and her fear of abandoning her parents.","Comedy, Drama, Music"
Planet of the Apes,An astronaut crew crash-lands on a planet where highly intelligent non-human ape species are dominant and humans are enslaved.,"Adventure, Sci-Fi"
Dances with Wolves,"Lieutenant John Dunbar, assigned to a remote western Civil War outpost, finds himself engaging with a neighbouring Sioux settlement, causing him to question his own purpose.","Adventure, Drama, Western"
The Imitation Game,"During World War II, the English mathematical genius Alan Turing tries to crack the German Enigma code with help from fellow mathematicians while attempting to come to terms with his troubled private life.","Biography, Drama, Thriller"
Big Fish,A frustrated son tries to determine the fact from fiction in his dying father's life.,"Adventure, Drama, Fantasy"
Groundhog Day,"A narcissistic, self-centered weatherman finds himself in a time loop on Groundhog Day.","Comedy, Drama, Fantasy"
Young Frankenstein,"An American grandson of the infamous scientist, struggling to prove that his grandfather was not as insane as people believe, is invited to Transylvania, where he discovers the process that reanimates a dead body.",Comedy
The Graduate,A disillusioned college graduate finds himself torn between his older lover and her daughter.,"Comedy, Drama, Romance"
Soul,"After landing the gig of a lifetime, a New York jazz pianist suddenly finds himself trapped in a strange land between Earth and the afterlife.","Animation, Adventure, Comedy"
Rosemary's Baby,"A young couple trying for a baby moves into an aging, ornate apartment building on Central Park West, where they find themselves surrounded by peculiar neighbors.","Drama, Horror"
Scent of a Woman,"A prep school student needing money agrees to ""babysit"" a blind man, but the job is not at all what he anticipated.",Drama
Aladdin,A kind-hearted street urchin and a power-hungry Grand Vizier vie for a magic lamp that has the power to make their deepest wishes come true.,"Animation, Adventure, Comedy"
JFK,New Orleans District Attorney Jim Garrison discovers there's more to the Kennedy assassination than the official story.,"Drama, History, Thriller"
Beauty and the Beast,A prince cursed to spend his days as a hideous monster sets out to regain his humanity by earning a young woman's love.,"Animation, Family, Fantasy"
12 Monkeys,"In a future world devastated by disease, a convict is sent back in time to gather information about the man-made virus that wiped out most of the human population on the planet.","Mystery, Sci-Fi, Thriller"
Magnolia,"An epic mosaic of interrelated characters in search of love, forgiveness and meaning in the San Fernando Valley.",Drama
Rain Man,"After a selfish L.A. yuppie learns his estranged father left a fortune to an autistic-savant brother in Ohio that he didn't know existed, he absconds with his brother and sets out across the country, hoping to gain a larger inheritance.",Drama
Akira,"A secret military project endangers Neo-Tokyo when it turns a biker gang member into a rampaging psychic psychopath who can only be stopped by a teenager, his gang of biker friends and a group of psychics.","Animation, Action, Drama"
The King's Speech,"The story of King George VI, his unexpected ascension to the throne of the British Empire in 1936, and the speech therapist who helped the unsure monarch overcome his stammer.","Biography, Drama, History"
Blood Diamond,"A fisherman, a smuggler, and a syndicate of businessmen match wits over the possession of a priceless diamond.","Adventure, Drama, Thriller"
The Pursuit of Happyness,A struggling salesman takes custody of his son as he's poised to begin a life-changing professional career.,"Biography, Drama"
Perfect Blue,"A pop singer gives up her career to become an actress, but she slowly goes insane when she starts being stalked by an obsessed fan and what seems to be a ghost of her past.","Animation, Crime, Drama"
The Night of the Hunter,"A self-proclaimed preacher marries a gullible widow whose young children are reluctant to tell him where their real dad hid the $10,000 he'd stolen in a robbery.","Crime, Drama, Film-Noir"
The Invisible Guest,A successful entrepreneur accused of murder and a witness preparation expert have less than three hours to come up with an impregnable defense.,"Crime, Drama, Mystery"
Slumdog Millionaire,"A Mumbai teenager reflects on his life after being accused of cheating on the Indian version of ""Who Wants to be a Millionaire?""","Crime, Drama, Romance"
Dogville,"A woman on the run from the mob is reluctantly accepted in a small Colorado community in exchange for labor, but when a search visits the town she finds out that their support has a price.","Crime, Drama"
Kill Bill: Vol. 2,"The Bride continues her quest of vengeance against her former boss and lover Bill, the reclusive bouncer Budd, and the treacherous, one-eyed Elle.","Action, Crime, Thriller"
The Last Picture Show,"In 1951, a group of high schoolers come of age in a bleak, isolated, atrophied North Texas town that is slowly dying, both culturally and economically.","Drama, Romance"
The Bourne Ultimatum,Jason Bourne dodges a ruthless C.I.A. official and his Agents from a new assassination program while searching for the origins of his life as a trained killer.,"Action, Mystery, Thriller"
Life of Brian,"Born on the original Christmas in the stable next door to Jesus Christ, Brian of Nazareth spends his life being mistaken for a messiah.",Comedy
Chungking Express,"Two melancholy Hong Kong policemen fall in love: one with a mysterious female underworld figure, the other with a beautiful and ethereal waitress at a late-night restaurant he frequents.","Comedy, Crime, Drama"
Do the Right Thing,"On the hottest day of the year on a street in the Bedford-Stuyvesant section of Brooklyn, everyone's hate and bigotry smolders and builds until it explodes into violence.","Comedy, Drama"
Sling Blade,"Karl Childers, a simple man hospitalized since his childhood murder of his mother and her lover, is released to start a new life in a small town.",Drama
Lion,"A five-year-old Indian boy is adopted by an Australian couple after getting lost hundreds of kilometers from home. 25 years later, he sets out to find his lost family.","Biography, Drama"
Dog Day Afternoon,"Three amateur bank robbers plan to hold up a bank. A nice simple robbery: Walk in, take the money, and run. Unfortunately, the supposedly uncomplicated heist suddenly becomes a bizarre nightmare as everything that could go wrong does.","Biography, Crime, Drama"
