Film,Omschrijving,Genres
The Shawshank Redemption,"Over the course of several years, two convicts form a friendship, seeking consolation and, eventually, redemption through basic compassion.",Drama
The Godfather,"Don Vito Corleone, head of a mafia family, decides to hand over his empire to his youngest son Michael. However, his decision unintentionally puts the lives of his loved ones in grave danger.","Crime, Drama"
The Dark Knight,"When the menace known as the Joker wreaks havoc and chaos on the people of Gotham, Batman must accept one of the greatest psychological and physical tests of his ability to fight injustice.","Action, Crime, Drama"
Schindler's List,"In German-occupied Poland during World War II, industrialist Oskar Schindler gradually becomes concerned for his Jewish workforce after witnessing their persecution by the Nazis.","Biography, Drama, History"
The Lord of the Rings: The Return of the King,Gandalf and Aragorn lead the World of Men against Sauron's army to draw his gaze from Frodo and Sam as they approach Mount Doom with the One Ring.,"Action, Adventure, Drama"
The Godfather Part II,"The early life and career of Vito Corleone in 1920s New York City is portrayed, while his son, Michael, expands and tightens his grip on the family crime syndicate.","Crime, Drama"
12 Angry Men,The jury in a New York City murder trial is frustrated by a single member whose skeptical caution forces them to more carefully consider the evidence before jumping to a hasty verdict.,"Crime, Drama"
Pulp Fiction,"The lives of two mob hitmen, a boxer, a gangster and his wife, and a pair of diner bandits intertwine in four tales of violence and redemption.","Crime, Drama"
Fight Club,An insomniac office worker and a devil-may-care soap maker form an underground fight club that evolves into much more.,Drama
Inception,"A thief who steals corporate secrets through the use of dream-sharing technology is given the inverse task of planting an idea into the mind of a C.E.O., but his tragic past may doom the project and his team to disaster.","Action, Adventure, Sci-Fi"
The Lord of the Rings: The Fellowship of the Ring,A meek Hobbit from the Shire and eight companions set out on a journey to destroy the powerful One Ring and save Middle-earth from the Dark Lord Sauron.,"Action, Adventure, Drama"
Forrest Gump,"The history of the United States from the 1950s to the '70s unfolds from the perspective of an Alabama man with an IQ of 75, who yearns to be reunited with his childhood sweetheart.","Drama, Romance"
The Lord of the Rings: The Two Towers,"While Frodo and Sam edge closer to Mordor with the help of the shifty Gollum, the divided fellowship makes a stand against Sauron's new ally, Saruman, and his hordes of Isengard.","Action, Adventure, Drama"
"The Good, the Bad and the Ugly",A bounty hunting scam joins two men in an uneasy alliance against a third in a race to find a fortune in gold buried in a remote cemetery.,"Adventure, Western"
Jai Bhim,"When a tribal man is arrested for a case of alleged theft, his wife turns to a human-rights lawyer to help bring justice.","Crime, Drama, Mystery"
777 Charlie,Dharma is stuck in a rut with his negative and lonely lifestyle and spends each day in the comfort of his loneliness. A pup named Charlie enters his life and gives him a new perspective towards it.,"Adventure, Comedy, Drama"
Spider-Man: Across the Spider-Verse,"Miles Morales catapults across the Multiverse, where he encounters a team of Spider-People charged with protecting its very existence. When the heroes clash on how to handle a new threat, Miles must redefine what it means to be a hero.","Animation, Action, Adventure"
Interstellar,"When Earth becomes uninhabitable in the future, a farmer and ex-NASA pilot, Joseph Cooper, is tasked to pilot a spacecraft, along with a team of researchers, to find a new planet for humans.","Adventure, Drama, Sci-Fi"
Goodfellas,"The story of Henry Hill and his life in the mafia, covering his relationship with his wife Karen and his mob partners Jimmy Conway and Tommy DeVito.","Biography, Crime, Drama"
The Matrix,"When a beautiful stranger leads computer hacker Neo to a forbidding underworld, he discovers the shocking truth--the life he knows is the elaborate deception of an evil cyber-intelligence.","Action, Sci-Fi"
One Flew Over the Cuckoo's Nest,"In the Fall of 1963, a Korean War veteran and criminal pleads insanity and is admitted to a mental institution, where he rallies up the scared patients against the tyrannical nurse.",Drama
Star Wars: Episode V - The Empire Strikes Back,"After the Rebels are overpowered by the Empire, Luke Skywalker begins his Jedi training with Yoda, while his friends are pursued across the galaxy by Darth Vader and bounty hunter Boba Fett.","Action, Adventure, Fantasy"
Soorarai Pottru,"Nedumaaran Rajangam ""Maara"" sets out to make the common man fly and in the process takes on the world's most capital intensive industry and several enemies who stand in his way.","Action, Drama"
Rocketry: The Nambi Effect,"Based on the life of Indian Space Research Organization scientist Nambi Narayanan, who was framed for being a spy and arrested in 1994. Though free, he continues to fight for justice against the officials who falsely implicated him.","Biography, Drama"
Se7en,"Two detectives, a rookie and a veteran, hunt a serial killer who uses the seven deadly sins as his motives.","Crime, Drama, Mystery"
The Silence of the Lambs,"A young F.B.I. cadet must receive the help of an incarcerated and manipulative cannibal killer to help catch another serial killer, a madman who skins his victims.","Crime, Drama, Thriller"
Saving Private Ryan,"Following the Normandy Landings, a group of U.S. soldiers go behind enemy lines to retrieve a paratrooper whose brothers have been killed in action.","Drama, War"
Star Wars: Episode IV - A New Hope,"Luke Skywalker joins forces with a Jedi Knight, a cocky pilot, a Wookiee and two droids to save the galaxy from the Empire's world-destroying battle station, while also attempting to rescue Princess Leia from the mysterious Darth Vader.","Action, Adventure, Fantasy"
Spirited Away,"During her family's move to the suburbs, a sullen 10-year-old girl wanders into a world ruled by gods, witches and spirits, a world where humans are changed into beasts.","Animation, Adventure, Family"
The Green Mile,"A tale set on death row in a Southern jail, where gentle giant John possesses the mysterious power to heal people's ailments. When the lead guard, Paul, recognizes John's gift, he tries to help stave off the condemned man's execution.","Crime, Drama, Fantasy"
City of God,"In the slums of Rio, two kids' paths diverge as one struggles to become a photographer and the other a kingpin.","Crime, Drama"
Terminator 2: Judgment Day,"A cyborg, identical to the one who failed to kill Sarah Connor, must now protect her ten year old son John from an even more advanced and powerful cyborg.","Action, Sci-Fi"
It's a Wonderful Life,An angel is sent from Heaven to help a desperately frustrated businessman by showing him what life would have been like if he had never existed.,"Drama, Family, Fantasy"
Life Is Beautiful,"When an open-minded Jewish waiter and his son become victims of the Holocaust, he uses a perfect mixture of will, humor and imagination to protect his son from the dangers around their camp.","Comedy, Drama, Romance"
Seven Samurai,"Farmers from a village exploited by bandits hire a veteran samurai for protection, who gathers six other samurai to join him.","Action, Drama"
Harakiri,"When a ronin requesting seppuku at a feudal lord's palace is told of the brutal suicide of another ronin who previously visited, he reveals how their pasts are intertwined - and in doing so challenges the clan's integrity.","Action, Drama, Mystery"
Sita Ramam,"An orphan soldier, Lieutenant Ram's life changes, after he gets a letter from a girl named Sita. He meets her and love blossoms between them. When he comes back to his camp in Kashmir,After he gets caught in jail, he sends a letter to Sita which won't reach her.","Action, Drama, Mystery"
Oppenheimer,"The story of American scientist, J. Robert Oppenheimer, and his role in the development of the atomic bomb.","Biography, Drama, History"
Whiplash,A promising young drummer enrolls at a cut-throat music conservatory where his dreams of greatness are mentored by an instructor who will stop at nothing to realize a student's potential.,"Drama, Music"
Gladiator,A former Roman General sets out to exact vengeance against the corrupt emperor who murdered his family and sent him into slavery.,"Action, Adventure, Drama"
Parasite,Greed and class discrimination threaten the newly formed symbiotic relationship between the wealthy Park family and the destitute Kim clan.,"Drama, Thriller"
The Departed,An undercover cop and a mole in the police attempt to identify each other while infiltrating an Irish gang in South Boston.,"Crime, Drama, Thriller"
Alien,The crew of a commercial spacecraft encounters a deadly lifeform after investigating an unknown transmission.,"Horror, Sci-Fi"
Back to the Future,"Marty McFly, a 17-year-old high school student, is accidentally sent 30 years into the past in a time-traveling DeLorean invented by his close friend, the maverick scientist Doc Brown.","Adventure, Comedy, Sci-Fi"
The Prestige,"After a tragic accident, two stage magicians in 1890s London engage in a battle to create the ultimate illusion while sacrificing everything they have to outwit each other.","Drama, Mystery, Sci-Fi"
Django Unchained,"With the help of a German bounty-hunter, a freed slave sets out to rescue his wife from a brutal plantation owner in Mississippi.","Drama, Western"
Léon: The Professional,"12-year-old Mathilda is reluctantly taken in by Léon, a professional assassin, after her family is murdered. An unusual relationship forms as she becomes his protégée and learns the assassin's trade.","Action, Crime, Drama"
The Usual Suspects,The sole survivor of a pier shoot-out tells the story of how a notorious criminal influenced the events that began with five criminals meeting in a seemingly random police lineup.,"Crime, Drama, Mystery"
The Lion King,"Lion prince Simba and his father are targeted by his bitter uncle, who wants to ascend the throne himself.","Animation, Adventure, Drama"
American History X,"Living a life marked by violence, neo-Nazi Derek finally goes to prison after killing two black youths. Upon his release, Derek vows to change; he hopes to prevent his brother, Danny, who idolizes Derek, from following in his footsteps.","Crime, Drama"
The Pianist,A Polish Jewish musician struggles to survive the destruction of the Warsaw ghetto of World War II.,"Biography, Drama, Music"
Psycho,"A Phoenix secretary embezzles $40,000 from her employer's client, goes on the run and checks into a remote motel run by a young man under the domination of his mother.","Horror, Mystery, Thriller"
The Intouchables,"After he becomes a quadriplegic from a paragliding accident, an aristocrat hires a young man from the projects to be his caregiver.","Biography, Comedy, Drama"
Casablanca,A cynical expatriate American cafe owner struggles to decide whether or not to help his former lover and her fugitive husband escape the Nazis in French Morocco.,"Drama, Romance, War"
Once Upon a Time in the West,A mysterious stranger with a harmonica joins forces with a notorious desperado to protect a beautiful widow from a ruthless assassin working for the railroad.,Western
Grave of the Fireflies,A young boy and his little sister struggle to survive in Japan during World War II.,"Animation, Drama, War"
Rear Window,"A photographer in a wheelchair spies on his neighbors from his Greenwich Village courtyard apartment window, and becomes convinced one of them has committed murder, despite the skepticism of his fashion-model girlfriend.","Mystery, Thriller"
Cinema Paradiso,A filmmaker recalls his childhood when falling in love with the pictures at the cinema of his home village and forms a deep friendship with the cinema's projectionist.,"Drama, Romance"
Kaithi,"Dilli, an ex-convict, endeavours to meet his daughter for the first time after leaving prison. However, his attempts are interrupted due to a drug raid planned by Inspector Bejoy.","Action, Crime, Thriller"
Modern Times,The Tramp struggles to live in modern industrial society with the help of a young homeless woman.,"Comedy, Drama, Romance"
City Lights,"With the aid of a wealthy erratic tippler, a dewy-eyed tramp who has fallen in love with a sightless flower girl accumulates money to be able to help her medically.","Comedy, Drama, Romance"
96,Two high school sweethearts meet at a reunion after 22 years and reminisce about their past.,"Drama, Romance"
Spider-Man: Into the Spider-Verse,Teen Miles Morales becomes the Spider-Man of his universe and must join with five spider-powered individuals from other dimensions to stop a threat for all realities.,"Animation, Action, Adventure"
Inglourious Basterds,"In Nazi-occupied France during World War II, a plan to assassinate Nazi leaders by a group of Jewish U.S. soldiers coincides with a theatre owner's vengeful plans for the same.","Adventure, Drama, War"
Avengers: Endgame,"After the devastating events of Avengers: Infinity War (2018), the universe is in ruins. With the help of remaining allies, the Avengers assemble once more in order to reverse Thanos' actions and restore balance to the universe.","Action, Adventure, Drama"
Joker,"During the 1980s, a failed stand-up comedian is driven insane and turns to a life of crime and chaos in Gotham City while becoming an infamous psychopathic crime figure.","Crime, Drama, Thriller"
Coco,"Aspiring musician Miguel, confronted with his family's ancestral ban on music, enters the Land of the Dead to find his great-great-grandfather, a legendary singer.","Animation, Adventure, Drama"
The Shining,"A family heads to an isolated hotel for the winter where a sinister presence influences the father into violence, while his psychic son sees horrific forebodings from both past and future.","Drama, Horror"
Apocalypse Now,A U.S. Army officer serving in Vietnam is tasked with assassinating a renegade Special Forces Colonel who sees himself as a god.,"Drama, Mystery, War"
Aliens,"Decades after surviving the Nostromo incident, Ellen Ripley is sent out to re-establish contact with a terraforming colony but finds herself battling the Alien Queen and her offspring.","Action, Adventure, Sci-Fi"
The Dark Knight Rises,"Eight years after the Joker's reign of chaos, Batman is coerced out of exile with the assistance of the mysterious Selina Kyle in order to defend Gotham City from the vicious guerrilla terrorist Bane.","Action, Drama, Thriller"
Avengers: Infinity War,The Avengers and their allies must be willing to sacrifice all in an attempt to defeat the powerful Thanos before his blitz of devastation and ruin puts an end to the universe.,"Action, Adventure, Sci-Fi"
Oldboy,"After being kidnapped and imprisoned for fifteen years, Oh Dae-Su is released, only to find that he must find his captor in five days.","Action, Drama, Mystery"
Memento,A man with short-term memory loss attempts to track down his wife's murderer.,"Mystery, Thriller"
Come and See,"After finding an old rifle, a young boy joins the Soviet resistance movement against ruthless German forces and experiences the horrors of World War II.","Drama, Thriller, War"
Raiders of the Lost Ark,"In 1936, archaeologist and adventurer Indiana Jones is hired by the U.S. government to find the Ark of the Covenant before the Nazis can obtain its awesome powers.","Action, Adventure"
Your Name.,"Two teenagers share a profound, magical connection upon discovering they are swapping bodies. Things manage to become even more complicated when the boy and girl decide to meet in person.","Animation, Drama, Fantasy"
Amadeus,"The life, success and troubles of Wolfgang Amadeus Mozart, as told by Antonio Salieri, the contemporaneous composer who was deeply jealous of Mozart's talent and claimed to have murdered him.","Biography, Drama, Music"
3 Idiots,"Two friends are searching for their long lost companion. They revisit their college days and recall the memories of their friend who inspired them to think differently, even as the rest of the world called them ""idiots"".","Comedy, Drama"
WALL·E,"In the distant future, a small waste-collecting robot inadvertently embarks on a space journey that will ultimately decide the fate of mankind.","Animation, Adventure, Family"
The Lives of Others,"In 1984 East Berlin, an agent of the secret police, conducting surveillance on a writer and his lover, finds himself becoming increasingly absorbed by their lives.","Drama, Mystery, Thriller"
Dr. Strangelove or: How I Learned to Stop Worrying and Love the Bomb,"An insane American general orders a bombing attack on the Soviet Union, triggering a path to nuclear holocaust that a war room full of politicians and generals frantically tries to stop.","Comedy, War"
Capernaum,"While serving a five-year sentence for a violent crime, a 12-year-old boy sues his parents for neglect.",Drama
Das Boot,A German U-boat stalks the frigid waters of the North Atlantic as its young crew experience the sheer terror and claustrophobic life of a submariner in World War II.,"Drama, War"
Sunset Blvd.,A screenwriter develops a dangerous relationship with a faded film star determined to make a triumphant return.,"Drama, Film-Noir"
Witness for the Prosecution,A veteran British barrister must defend his client in a murder trial that has surprise after surprise.,"Crime, Drama, Mystery"
Paths of Glory,"After refusing to attack an enemy position, a general accuses the soldiers of cowardice and their commanding officer must defend them.","Drama, War"
The Great Dictator,Dictator Adenoid Hynkel tries to expand his empire while a poor Jewish barber tries to avoid persecution from Hynkel's regime.,"Comedy, Drama, War"
High and Low,An executive of a Yokohama shoe company becomes a victim of extortion when his chauffeur's son is kidnapped by mistake and held for ransom.,"Crime, Drama, Mystery"
Sardar Udham,"A biopic detailing the 2 decades that Punjabi Sikh revolutionary, Udham Singh, spent planning the assassination of the man responsible for the Jallianwala Bagh massacre.","Biography, Crime, Drama"
Asuran,"The teenage son of a farmer from an underprivileged caste kills a rich, upper caste landlord. How the pacifist farmer saves his hot-blooded son is the rest of the story.","Action, Drama"
Drishyam 2,A gripping tale of an investigation and a family which is threatened by it. Will Georgekutty be able to protect his family this time?,"Crime, Drama, Thriller"
Top Gun: Maverick,"After thirty years, Maverick is still pushing the envelope as a top naval aviator, but must confront ghosts of his past when he leads TOP GUN's elite graduates on a mission that demands the ultimate sacrifice from those chosen to fly it.","Action, Drama"
American Beauty,A sexually frustrated suburban father has a mid-life crisis after becoming infatuated with his daughter's best friend.,Drama
Heat,A group of high-end professional thieves start to feel the heat from the LAPD when they unknowingly leave a clue at their latest heist.,"Action, Crime, Drama"
Good Will Hunting,"Will Hunting, a janitor at M.I.T., has a gift for mathematics, but needs help from a psychologist to find direction in his life.","Drama, Romance"
Scarface,"In 1980 Miami, a determined Cuban immigrant takes over a drug cartel and succumbs to greed.","Crime, Drama"
Requiem for a Dream,The drug-induced utopias of four Coney Island people are shattered when their addictions run deep.,Drama
Eternal Sunshine of the Spotless Mind,"When their relationship turns sour, a couple undergoes a medical procedure to have each other erased from their memories for ever.","Drama, Romance, Sci-Fi"
Braveheart,Scottish warrior William Wallace leads his countrymen in a rebellion to free his homeland from the tyranny of King Edward I of England.,"Biography, Drama, History"
2001: A Space Odyssey,"After uncovering a mysterious artifact buried beneath the Lunar surface, a spacecraft is sent to Jupiter to find its origins: a spacecraft manned by two men and the supercomputer HAL 9000.","Adventure, Sci-Fi"
A Clockwork Orange,"In the future, a sadistic gang leader is imprisoned and volunteers for a conduct-aversion experiment, but it doesn't go as planned.","Crime, Sci-Fi"
The Hunt,"A teacher lives a lonely life, all the while struggling over his son's custody. His life slowly gets better as he finds love and receives good news from his son, but his new luck is about to be brutally shattered by an innocent little lie.",Drama
Once Upon a Time in America,"A former Prohibition-era Jewish gangster returns to the Lower East Side of Manhattan 35 years later, where he must once again confront the ghosts and regrets of his old life.","Crime, Drama"
Full Metal Jacket,A pragmatic U.S. Marine observes the dehumanizing effects the Vietnam War has on his fellow recruits from their brutal boot camp training to the bloody street fighting in Hue.,"Drama, War"
Reservoir Dogs,"When a simple jewelry heist goes horribly wrong, the surviving criminals begin to suspect that one of them is a police informant.","Crime, Thriller"
Toy Story,A cowboy doll is profoundly threatened and jealous when a new spaceman action figure supplants him as top toy in a boy's bedroom.,"Animation, Adventure, Comedy"
Citizen Kane,"Following the death of publishing tycoon Charles Foster Kane, reporters scramble to uncover the meaning of his final utterance: 'Rosebud.'","Drama, Mystery"
Hamilton,"The real life of one of America's foremost founding fathers and first Secretary of the Treasury, Alexander Hamilton. Captured live on Broadway from the Richard Rodgers Theater with the original Broadway cast.","Biography, Drama, History"
Up,"78-year-old Carl Fredricksen travels to Paradise Falls in his house equipped with balloons, inadvertently taking a young stowaway.","Animation, Adventure, Comedy"
Amélie,"Despite being caught in her imaginative world, Amelie, a young waitress, decides to help people find happiness. Her quest to spread joy leads her on a journey where she finds true love.","Comedy, Romance"
Incendies,Twins journey to the Middle East to discover their family history and fulfill their mother's last wishes.,"Drama, Mystery, War"
Lawrence of Arabia,"The story of T.E. Lawrence, the English officer who successfully united and led the diverse, often warring, Arab tribes during World War I in order to fight the Turks.","Adventure, Biography, Drama"
Princess Mononoke,"On a journey to find the cure for a Tatarigami's curse, Ashitaka finds himself in the middle of a war between the forest gods and Tatara, a mining colony. In this quest he also meets San, the Mononoke Hime.","Animation, Action, Adventure"
Star Wars: Episode VI - Return of the Jedi,"After rescuing Han Solo from Jabba the Hutt, the Rebels attempt to destroy the second Death Star, while Luke struggles to help Darth Vader back from the dark side.","Action, Adventure, Fantasy"
Vikram,"A special investigator discovers a case of serial killings is not what it seems to be, and leading down this path is only going to end in a war between everyone involved.","Action, Crime, Thriller"
To Kill a Mockingbird,"Atticus Finch, a widowed lawyer in Depression-era Alabama, defends a Black man against an undeserved rape charge, and tries to educate his young children against prejudice.","Crime, Drama"
Toy Story 3,"The toys are mistakenly delivered to a day-care center instead of the attic right before Andy leaves for college, and it's up to Woody to convince the other toys that they weren't abandoned and to return home.","Animation, Adventure, Comedy"
Metropolis,"In a futuristic city sharply divided between the working class and the city planners, the son of the city's mastermind falls in love with a working-class prophet who predicts the coming of a savior to mediate their differences.","Drama, Sci-Fi"
Vertigo,"A former San Francisco police detective juggles wrestling with his personal demons and becoming obsessed with the hauntingly beautiful woman he has been hired to trail, who may be deeply disturbed.","Mystery, Romance, Thriller"
Singin' in the Rain,A silent film star falls for a chorus girl just as he and his delusionally jealous screen partner are trying to make the difficult transition to talking pictures in 1920s Hollywood.,"Comedy, Musical, Romance"
The Sting,Two grifters team up to pull off the ultimate con.,"Comedy, Crime, Drama"
M,"When the police in a German city are unable to catch a child-murderer, other criminals join in the manhunt.","Crime, Mystery, Thriller"
A Separation,A married couple are faced with a difficult decision - to improve the life of their child by moving to another country or to stay in Iran and look after a deteriorating parent who has Alzheimer's disease.,Drama
North by Northwest,"A New York City advertising executive goes on the run after being mistaken for a government agent by a group of foreign spies, and falls for a woman whose loyalties he begins to doubt.","Action, Adventure, Mystery"
The Apartment,"A Manhattan insurance clerk tries to rise in his company by letting its executives use his apartment for trysts, but complications and a romance of his own ensue.","Comedy, Drama, Romance"
Dangal,Former wrestler Mahavir Singh Phogat and his two wrestler daughters struggle towards glory at the Commonwealth Games in the face of societal oppression.,"Action, Biography, Drama"
Double Indemnity,"A Los Angeles insurance representative lets an alluring housewife seduce him into a scheme of insurance fraud and murder that arouses the suspicion of his colleague, an insurance investigator.","Crime, Drama, Film-Noir"
