Film,Omschrijving,Genres
A Streetcar Named Desire,Disturbed Blanche DuBois moves in with her sister in New Orleans and is tormented by her brutish brother-in-law while her reality crumbles around her.,Drama
Wings of Desire,"An angel tires of his purely ethereal life of merely overseeing the human activity of Berlin's residents, and longs for the tangible joys of physical existence when he falls in love with a mortal.","Drama, Fantasy, Romance"
Shoplifters,"On the margins of Tokyo, a dysfunctional band of outsiders are united by loyalty, a penchant for petty theft and playful grifting. When the young son is arrested, secrets are exposed that upend their tenuous, below-the-radar existence.","Crime, Drama, Thriller"
In the Heat of the Night,"A black Philadelphia police detective is mistakenly suspected of a local murder while passing through a racially hostile Mississippi town, and after being cleared is reluctantly asked by the police chief to investigate the case.","Drama, Mystery, Thriller"
A Fistful of Dollars,"A wandering gunfighter plays two rival families against each other in a town torn apart by greed, pride, and revenge.","Action, Drama, Western"
Hero,"A defense officer, Nameless, was summoned by the King of Qin regarding his success of terminating three warriors.","Action, Adventure, Drama"
King Kong,"A film crew goes to a tropical island for a location shoot, where they capture a colossal ape who takes a shine to their blonde starlet, and bring him back to New York City.","Adventure, Horror, Sci-Fi"
Dancer in the Dark,An Eastern European US immigrant with a love for musicals has to cope with the gradual loss of her vision.,"Crime, Drama, Musical"
Laura,A police detective falls in love with the woman whose murder he is investigating.,"Drama, Film-Noir, Mystery"
The Manchurian Candidate,An American POW in the Korean War is brainwashed as an unwitting assassin for an international Communist conspiracy.,"Drama, Thriller"
Togo,"The story of Togo, the sled dog who led the 1925 serum run despite being considered too small and weak to lead such an intense race.","Adventure, Biography, Drama"
Notorious,The daughter of a convicted Nazi spy is asked by American agents to gather information on a ring of Nazi scientists in South America. How far will she have to go to ingratiate herself with them?,"Drama, Film-Noir, Romance"
The Artist,An egomaniacal film star develops a relationship with a young dancer against the backdrop of Hollywood's silent era.,"Comedy, Drama, Romance"
In Cold Blood,"Two ex-cons murder a family in a robbery attempt, before going on the run from the authorities. The police try to piece together the details of the murder in an attempt to track down the killers.","Biography, Crime, Drama"
The Big Sleep,"Private detective Philip Marlowe is hired by a wealthy family. Before the complex case is over, he's seen murder, blackmail and what might be love.","Crime, Film-Noir, Mystery"
Arsenic and Old Lace,A Brooklyn writer of books on the futility of marriage risks his reputation after he decides to tie the knot. Things get even more complicated when he learns on his wedding day that his beloved maiden aunts are habitual murderers.,"Comedy, Crime, Thriller"
Harold and Maude,"Young, rich, and obsessed with death, Harold finds himself changed forever when he meets lively septuagenarian Maude at a funeral.","Comedy, Drama, Romance"
The Killing,Crook Johnny Clay assembles a five-man team to plan and execute a daring racetrack robbery.,"Crime, Drama, Film-Noir"
The Raid 2,"Only a short time after the first raid, Rama goes undercover with the thugs of Jakarta and plans to bring down the syndicate and uncover the corruption within his police force.","Action, Crime, Thriller"
Patton,The World War II phase of the career of controversial American general George S. Patton.,"Biography, Drama, War"
Strangers on a Train,A psychopathic man tries to forcibly persuade a tennis star to agree to his theory that two strangers can get away with murder by submitting to his plan to kill the other's most-hated person.,"Crime, Drama, Film-Noir"
Three Colors: Blue,A woman struggles to find a way to live her life after the death of her husband and child.,"Drama, Music, Mystery"
In a Lonely Place,"A potentially violent screenwriter is a murder suspect until his lovely neighbor clears him. However, she soon starts to have her doubts.","Drama, Film-Noir, Mystery"
Harvey,"Due to his insistence that he has an invisible six foot-tall rabbit for a best friend, a whimsical middle-aged man is thought by his family to be insane - but he may be wiser than anyone knows.","Comedy, Drama, Fantasy"
Head-On,"With the intention to break free from the strict familial restrictions, a suicidal young woman sets up a marriage of convenience with a forty-year-old addict, an act that will lead to an outburst of envious love.","Drama, Romance"
My Name Is Khan,An Indian Muslim man with Asperger's syndrome takes a challenge to speak to the President of the United States seriously and embarks on a cross-country journey.,"Adventure, Drama, Romance"
Once Were Warriors,A family descended from Maori warriors is bedeviled by a violent father and the societal problems of being treated as outcasts.,"Crime, Drama"
The Conformist,"A weak-willed Italian man becomes a fascist flunky who goes abroad to arrange the assassination of his old teacher, now a political dissident.",Drama
Talk to Her,Two men share an odd friendship while they care for two women who are both in deep comas.,"Drama, Mystery, Romance"
Amour,"Georges and Anne are an octogenarian couple. They are cultivated, retired music teachers. Their daughter, also a musician, lives in Britain with her family. One day, Anne has a stroke, and the couple's bond of love is severely tested.",Drama
The Adventures of Robin Hood,"When Prince John and the Norman Lords begin oppressing the Saxon masses in King Richard's absence in 1190s England, a Saxon lord fights back as the outlaw leader of a resistance movement.","Action, Adventure, Romance"
Mildred Pierce,A hard-working mother inches towards disaster as she divorces her husband and starts a successful restaurant business to support her spoiled daughter.,"Crime, Drama, Film-Noir"
The Sacrifice,"At the dawn of World War III, a man searches for a way to restore peace to the world and finds he must give something in return.",Drama
The Philadelphia Story,"When a rich woman's ex-husband and a tabloid-type reporter turn up just before her planned remarriage, she begins to learn the truth about herself.","Comedy, Romance"
Cat on a Hot Tin Roof,Brick is an alcoholic ex-football player who drinks his days away and resists the affections of his wife. A reunion with his terminal father jogs a host of memories and revelations for both father and son.,Drama
A Taxi Driver,"A widowed father and taxi driver who drives a German reporter from Seoul to Gwangju to cover the 1980 uprising, soon finds himself regretting his decision after being caught in the violence around him.","Action, Drama, History"
The Thin Man,"Former detective Nick Charles and his wealthy wife Nora investigate a murder case, mostly for the fun of it.","Comedy, Crime, Mystery"
The Red Circle,"After leaving prison, master thief Corey crosses paths with a notorious escapee and an alcoholic former policeman. The trio proceed to plot an elaborate heist.","Crime, Drama, Thriller"
Nine Queens,"Two con artists try to swindle a stamp collector by selling him a sheet of counterfeit rare stamps (the ""nine queens"").","Crime, Drama, Thriller"
Kal Ho Naa Ho,"Naina, an introverted, perpetually depressed girl's life changes when she meets Aman. But Aman has a secret of his own which changes their lives forever. Embroiled in all this is Rohit, Naina's best friend who conceals his love for her.","Comedy, Drama, Musical"
My Man Godfrey,A scatterbrained socialite hires a vagrant as a family butler - but there's more to Godfrey than meets the eye.,"Comedy, Drama, Romance"
Elevator to the Gallows,"A self-assured businessman murders his employer, the husband of his mistress, which unintentionally provokes an ill-fated chain of events.","Crime, Drama, Thriller"
Cléo from 5 to 7,"Cleo, a singer and hypochondriac, becomes increasingly worried that she might have cancer while awaiting test results from her doctor.","Comedy, Drama, Music"
Amarcord,A series of comedic and nostalgic vignettes set in a 1930s Italian coastal town.,"Comedy, Drama"
Kagemusha,A petty thief with an utter resemblance to a samurai warlord is hired as the lord's double. When the warlord later dies the thief is forced to take up arms in his place.,"Drama, History, War"
The Return,"In the Russian wilderness, two brothers face a range of new, conflicting emotions when their father - a man they know only through a single photograph - resurfaces.",Drama
Battleship Potemkin,"In the midst of the Russian Revolution of 1905, the crew of the battleship Potemkin mutiny against the brutal, tyrannical regime of the vessel's officers. The resulting street demonstration in Odessa brings on a police massacre.","Drama, History, Thriller"
About Elly,The mysterious disappearance of a kindergarten teacher during a picnic in the north of Iran is followed by a series of misadventures for her fellow travelers.,"Drama, Mystery"
3-Iron,A transient young man breaks into empty homes to partake of the vacationing residents' lives for a few days.,"Crime, Drama, Romance"
Nostalghia,"A Russian poet and his interpreter travel to Italy researching the life of an 18th-century composer, and instead meet a ruminative madman who tells the poet how the world may be saved.",Drama
The Way He Looks,"Leonardo is a blind teenager searching for independence. His everyday life, the relationship with his best friend Giovana, and the way he sees the world change completely with the arrival of Gabriel.","Drama, Romance"
The Big Heat,Tough cop Dave Bannion takes on a politically powerful crime syndicate.,"Crime, Film-Noir, Thriller"
"4 Months, 3 Weeks and 2 Days",A woman assists her friend in arranging an illegal abortion in 1980s Romania.,Drama
Super 30,Based on the life of Patna-based mathematician Anand Kumar who runs the famed Super 30 program for IIT aspirants in Patna.,"Biography, Drama"
Jab We Met,A depressed wealthy businessman finds his life changing after he meets a spunky and care-free young woman.,"Comedy, Drama, Romance"
Gully Boy,A coming-of-age story based on the lives of street rappers in Mumbai.,"Drama, Music, Romance"
The Rules of the Game,"A bourgeois life in France at the onset of World War II, as the rich and their poor servants meet up at a French chateau.","Comedy, Drama"
The Lost Weekend,The desperate life of a chronic alcoholic is followed through a four-day drinking bout.,"Drama, Film-Noir"
No Man's Land,"Bosnia and Herzegovina during 1993 at the time of the heaviest fighting between the two warring sides. Two soldiers from opposing sides in the conflict, Nino and Ciki, become trapped in no man's land, whilst a third soldier becomes a living booby trap.","Comedy, Drama, War"
Beauty and the Beast,"A beautiful young woman takes her father's place as the prisoner of a mysterious beast, who wishes to marry her.","Drama, Fantasy, Romance"
Sullivan's Travels,Hollywood director John L. Sullivan sets out to experience life as a homeless person in order to gain relevant life experience for his next movie.,"Adventure, Comedy, Drama"
C.R.A.Z.Y.,"A young French Canadian, one of five boys in a conservative family in the 1960s and 1970s, struggles to reconcile his emerging identity with his father's values.","Comedy, Drama"
Pad Man,"Upon realizing the extent to which women are affected by their menses, a man sets out to create a sanitary pad machine and to provide inexpensive sanitary pads to the women of rural India.","Comedy, Drama"
Dev.D,"After breaking up with his childhood sweetheart, a young man finds solace in drugs. Meanwhile, a teenage girl is caught in the world of prostitution. Will they be destroyed, or will they find redemption?","Comedy, Drama, Romance"
Through a Glass Darkly,"Recently released from a mental hospital, Karin rejoins her emotionally disconnected family in their island home, only to slip from reality as she begins to believe she is being visited by God.",Drama
Airlift,"When Iraq invades Kuwait in August 1990, a callous Indian businessman becomes the spokesperson for more than 170,000 stranded countrymen.","Action, Drama, History"
Baby,"An elite counter-intelligence unit learns of a plot, masterminded by a maniacal madman. With the clock ticking, it's up to them to track the terrorists' international tentacles and prevent them from striking at the heart of India.","Action, Crime, Thriller"
Badhaai Ho,A man is embarrassed when he finds out his mother is pregnant.,"Comedy, Drama"
Mission: Impossible - Dead Reckoning Part One,Ethan Hunt and his IMF team must track down a dangerous weapon before it falls into the wrong hands.,"Action, Adventure, Thriller"
The Batman,"When a sadistic serial killer begins murdering key political figures in Gotham, Batman is forced to investigate the city's hidden corruption and question his family's involvement.","Action, Crime, Drama"
Everything Everywhere All at Once,A middle-aged Chinese immigrant is swept up into an insane adventure in which she alone can save existence by exploring other universes and connecting with the lives she could have led.,"Action, Adventure, Comedy"
Get Out,"A young African-American visits his White girlfriend's parents for the weekend, where his simmering uneasiness about their reception of him eventually reaches a boiling point.","Horror, Mystery, Thriller"
The Girl with the Dragon Tattoo,Journalist Mikael Blomkvist is aided in his search for a woman who has been missing for 40 years by young computer hacker Lisbeth Salander.,"Crime, Drama, Mystery"
Ghostbusters,"Three parapsychologists forced out of their university funding set up shop as a unique ghost removal service in New York City, attracting frightened yet skeptical customers.","Action, Comedy, Fantasy"
The Social Network,"As Harvard student Mark Zuckerberg creates the social networking site that would become known as Facebook, he is sued by the twins who claimed he stole their idea and by the co-founder who was later squeezed out of the business.","Biography, Drama"
The Gentlemen,"An American expat tries to sell off his highly profitable marijuana empire in London, triggering plots, schemes, bribery and blackmail in an attempt to steal his domain out from under him.","Action, Crime"
The Irishman,"An illustration of Frank Sheeran's life, from W.W.II veteran to hit-man for the Bufalino crime family and his alleged assassination of his close friend Jimmy Hoffa.","Biography, Crime, Drama"
Pride & Prejudice,"Sparks fly when spirited Elizabeth Bennet meets single, rich, and proud Mr. Darcy. But Mr. Darcy reluctantly finds himself falling in love with a woman beneath his class. Can each overcome their own pride and prejudice?","Drama, Romance"
Tombstone,"A successful lawman's plans to retire anonymously in Tombstone, Arizona are disrupted by the kind of outlaws he was famous for eliminating.","Biography, Drama, History"
Drive,A mysterious Hollywood action film stuntman gets in trouble with gangsters when he tries to help his neighbor's husband rob a pawn shop while serving as his getaway driver.,"Action, Drama"
All Quiet on the Western Front,A young German soldier's terrifying experiences and distress on the western front during World War I.,"Action, Drama, War"
The Notebook,An elderly man reads to a woman with dementia the story of two young lovers whose romance is threatened by the difference in their respective social classes.,"Drama, Romance"
Puss in Boots: The Last Wish,"When Puss in Boots discovers that his passion for adventure has taken its toll and he has burned through eight of his nine lives, he launches an epic journey to restore them by finding the mythical Last Wish.","Animation, Adventure, Comedy"
The Breakfast Club,Five high school students meet in Saturday detention and discover how they have a great deal more in common than they thought.,"Comedy, Drama"
Ferris Bueller's Day Off,"A popular high school student, admired by his peers, decides to take a day off from school and goes to extreme lengths to pull it off, to the chagrin of his Principal, who'll do anything to stop him.",Comedy
About Time,"At the age of 21, Tim discovers he can travel in time and change what happens and has happened in his own life. His decision to make his world a better place by getting a girlfriend turns out not to be as easy as you might think.","Comedy, Drama, Fantasy"
Apocalypto,"As the Mayan kingdom faces its decline, a young man is taken on a perilous journey to a world ruled by fear and oppression.","Action, Adventure, Drama"
Little Women,"Jo March reflects back and forth on her life, telling the beloved story of the March sisters - four young women, each determined to live life on her own terms.","Drama, Romance"
The Big Short,"In 2006-2007 a group of investors bet against the United States mortgage market. In their research, they discover how flawed and corrupt the market is.","Biography, Comedy, Drama"
Willy Wonka & the Chocolate Factory,A poor but hopeful boy seeks one of the five coveted golden tickets that will send him on a tour of Willy Wonka's mysterious chocolate factory.,"Family, Fantasy, Musical"
A Bronx Tale,"Robert De Niro and Chazz Palminteri give captivating performances in this intense drama about a boy torn between his tough, hard-working father and a violent yet charismatic crime boss.","Crime, Drama"
Skyfall,"James Bond's loyalty to M is tested when her past comes back to haunt her. When MI6 comes under attack, 007 must track down and destroy the threat, no matter how personal the cost.","Action, Adventure, Thriller"
Call Me by Your Name,"In 1980s Italy, romance blossoms between a seventeen-year-old student and the older man hired as his father's research assistant.","Drama, Romance"
The Hateful Eight,"In the dead of a Wyoming winter, a bounty hunter and his prisoner find shelter in a cabin currently inhabited by a collection of nefarious characters.","Crime, Drama, Mystery"
The Hobbit: An Unexpected Journey,"A reluctant Hobbit, Bilbo Baggins, sets out to the Lonely Mountain with a spirited group of dwarves to reclaim their mountain home, and the gold within it from the dragon Smaug.","Adventure, Fantasy"
Predator,A team of commandos on a mission in a Central American jungle find themselves hunted by an extraterrestrial warrior.,"Action, Adventure, Horror"
Misery,"After a famous author is rescued from a car crash by a fan of his novels, he comes to realize that the care he is receiving is only the beginning of a nightmare of captivity and abuse.","Drama, Thriller"
The Curious Case of Benjamin Button,"Tells the story of Benjamin Button, a man who starts aging backwards with consequences.","Drama, Fantasy, Romance"
Dunkirk,"Allied soldiers from Belgium, the British Commonwealth and Empire, and France are surrounded by the German Army and evacuated during a fierce battle in World War II.","Action, Drama, History"
Rogue One: A Star Wars Story,"In a time of conflict, a group of unlikely heroes band together on a mission to steal the plans to the Death Star, the Empire's ultimate weapon of destruction.","Action, Adventure, Sci-Fi"
American Gangster,"An outcast New York City cop is charged with bringing down Harlem drug lord Frank Lucas, whose real life inspired this partly biographical film.","Biography, Crime, Drama"
The Untouchables,"During Prohibition, Treasury agent Eliot Ness sets out to stop ruthless Chicago gangster Al Capone, and assembles a small, incorruptible team to help him.","Crime, Drama, Thriller"
Nightcrawler,"When Louis Bloom, a con man desperate for work, muscles into the world of L.A. crime journalism, he blurs the line between observer and participant to become the star of his own story.","Crime, Drama, Thriller"
Remember the Titans,The true story of a newly appointed African-American coach and his high school team on their first season as a racially integrated unit.,"Biography, Drama, Sport"
RRR,A fictitious story about two legendary revolutionaries and their journey away from home before they started fighting for their country in the 1920s.,"Action, Drama"
Hidden Figures,The story of a team of female African-American mathematicians who served a vital role in NASA during the early years of the U.S. space program.,"Biography, Drama, History"
The Bourne Identity,"A man is picked up by a fishing boat, bullet-riddled and suffering from amnesia, before racing to elude assassins and attempting to regain his memory.","Action, Mystery, Thriller"
Little Miss Sunshine,A family determined to get their young daughter into the finals of a beauty pageant take a cross-country trip in their VW bus.,"Comedy, Drama"
Freaks,"A circus' beautiful trapeze artist agrees to marry the leader of side-show performers, but his deformed friends discover she is only marrying him for his inheritance.","Drama, Horror"
Atonement,Thirteen-year-old fledgling writer Briony Tallis irrevocably changes the course of several lives when she accuses her older sister's lover of a crime he did not commit.,"Drama, Mystery, Romance"
Star Wars: Episode VII - The Force Awakens,"As a new threat to the galaxy rises, Rey, a desert scavenger, and Finn, an ex-stormtrooper, must join Han Solo and Chewbacca to search for the one hope of restoring peace.","Action, Adventure, Sci-Fi"
The Sandlot,"In the summer of 1962, a new kid in town is taken under the wing of a young baseball prodigy and his rowdy team, resulting in many adventures.","Comedy, Drama, Family"
Straight Outta Compton,"The rap group NWA emerges from the mean streets of Compton in Los Angeles, California, in the mid-1980s and revolutionizes Hip Hop culture with their music and tales about life in the hood.","Biography, Drama, History"
Manchester by the Sea,A depressed uncle is asked to take care of his teenage nephew after the boy's father dies.,Drama
Hot Fuzz,"A skilled London police officer, after irritating superiors with his embarrassing effectiveness, is transferred to a village where the easygoing officers object to his fervor for regulations, as a string of grisly murders strikes the town.","Action, Comedy, Mystery"
The Last Samurai,An American military advisor embraces the Samurai culture he was hired to destroy after he is captured in battle.,"Action, Drama"
Taken,"A retired CIA agent travels across Europe and relies on his old skills to save his estranged daughter, who has been kidnapped while on a trip to Paris.","Action, Crime, Thriller"
Mary Poppins,"In turn of the century London, a magical nanny employs music and adventure to help two neglected children become closer to their father.","Comedy, Family, Fantasy"
Captain America: Civil War,Political involvement in the Avengers' affairs causes a rift between Captain America and Iron Man.,"Action, Sci-Fi"
Captain Fantastic,"In the forests of the Pacific Northwest, a father devoted to raising his six kids with a rigorous physical and intellectual education is forced to leave his paradise and enter the world, challenging his idea of what it means to be a parent.","Comedy, Drama"
Back to the Future Part II,"After visiting 2015, Marty McFly must repeat his visit to 1955 to prevent disastrous changes to 1985...without interfering with his first trip.","Adventure, Comedy, Sci-Fi"
Big Hero 6,"A special bond develops between plus-sized inflatable robot Baymax and prodigy Hiro Hamada, who together team up with a group of friends to form a band of high-tech heroes.","Animation, Action, Adventure"
The Hobbit: The Desolation of Smaug,"The dwarves, along with Bilbo Baggins and Gandalf the Grey, continue their quest to reclaim Erebor, their homeland, from Smaug. Bilbo Baggins is in possession of a mysterious and magical ring.","Adventure, Drama, Fantasy"
Cast Away,A FedEx executive undergoes a physical and emotional transformation after crash landing on a deserted island.,"Adventure, Drama, Romance"
The Fugitive,"Dr. Richard Kimble, unjustly accused of murdering his wife, must find the real killer while being the target of a nationwide manhunt led by a seasoned U.S. Marshal.","Action, Crime, Drama"
Boyz n the Hood,"Follows the lives of three young males living in the Crenshaw ghetto of Los Angeles, dissecting questions of race, relationships, violence, and future prospects.","Crime, Drama"
Captain America: The Winter Soldier,"As Steve Rogers struggles to embrace his role in the modern world, he teams up with a fellow Avenger and S.H.I.E.L.D agent, Black Widow, to battle a new threat from history: an assassin known as the Winter Soldier.","Action, Adventure, Sci-Fi"
Moonrise Kingdom,"A pair of young lovers flee their New England town, which causes a local search party to fan out to find them.","Comedy, Drama, Family"
I Saw the Devil,A secret agent exacts revenge on a serial killer through a series of captures and releases.,"Action, Crime, Thriller"
Moon,"Astronaut Sam Bell has a quintessentially personal encounter toward the end of his three-year stint on the Moon, where he, working alongside his computer, GERTY, sends back to Earth parcels of a resource that has helped diminish our planet's power problems.","Drama, Mystery, Sci-Fi"
The Girl with the Dragon Tattoo,A journalist is aided by a young female hacker in his search for the killer of a woman who has been dead for forty years.,"Crime, Drama, Mystery"
Close,"The intense friendship between two thirteen-year old boys Leo and Remi suddenly gets disrupted. Struggling to understand what has happened, Léo approaches Sophie, Rémi's mother. ""Close"" is a film about friendship and responsibility.",Drama
