Film,Omschrijving,Genres
Paddington 2,"Paddington, now happily settled with the Brown family and a popular member of the local community, picks up a series of odd jobs to buy the perfect present for his Aunt Lucy's 100th birthday, only for the gift to be stolen.","Adventure, Comedy, Family"
The Man from Earth,An impromptu goodbye party for Professor John Oldman becomes a mysterious interrogation after the retiring scholar reveals to his colleagues he has a longer and stranger past than they can imagine.,"Drama, Fantasy, Mystery"
The Fighter,"Based on the story of Micky Ward, a fledgling boxer who tries to escape the shadow of his more famous but troubled older boxing brother and get his own shot at greatness.","Action, Biography, Drama"
The King of Comedy,"Rupert Pupkin is a passionate yet unsuccessful comic who craves nothing more than to be in the spotlight and to achieve this, he stalks and kidnaps his idol to take the spotlight for himself.","Comedy, Crime, Drama"
The Remains of the Day,A butler who sacrificed body and soul to service in the years leading up to World War II realizes too late how misguided his loyalty was to his lordly employer.,"Drama, Romance"
Jujutsu Kaisen 0,A high schooler gains control of an extremely powerful Cursed Spirit and gets enrolled in the Tokyo Prefectural Jujutsu High School by Jujutsu Sorcerers to help him control his power and keep an eye on him.,"Animation, Action, Fantasy"
Midnight Cowboy,"A naive hustler travels from Texas to New York City to seek personal fortune, finding a new friend in the process.",Drama
The Fall,"In 1920s Los Angeles, a bedridden patient in a hospital captivates a young girl with a fantastic tale of heroes, myths, and villains on a desert island.","Adventure, Drama, Fantasy"
The Killing Fields,"A journalist is trapped in Cambodia during tyrant Pol Pot's bloody 'Year Zero' cleansing campaign, which claimed the lives of two million 'undesirable' civilians.","Biography, Drama, History"
Mississippi Burning,Two F.B.I. Agents with wildly different styles arrive in Mississippi to investigate the disappearance of some civil rights activists.,"Crime, Drama, Mystery"
The Searchers,An American Civil War veteran embarks on a years-long journey to rescue his niece from the Comanches after the rest of his brother's family is massacred in a raid on their Texas farm.,"Adventure, Drama, Western"
Let the Right One In,"Oskar, an overlooked and bullied boy, finds love and revenge through Eli, a beautiful but peculiar girl.","Drama, Fantasy, Horror"
The Holy Mountain,"In a corrupt, greed-fueled world, a powerful alchemist leads a messianic character and seven materialistic figures to the Holy Mountain, where they hope to achieve enlightenment.","Adventure, Drama, Fantasy"
Serenity,The crew of the ship Serenity try to evade an assassin sent to recapture telepath River.,"Action, Adventure, Sci-Fi"
Hunt for the Wilderpeople,A national manhunt is ordered for a rebellious kid and his foster uncle who go missing in the wild New Zealand bush.,"Adventure, Comedy, Drama"
Walk the Line,"A chronicle of country music legend Johnny Cash's life, from his early days on an Arkansas cotton farm to his rise to fame with Sun Records in Memphis, where he recorded alongside Elvis Presley, Jerry Lee Lewis, and Carl Perkins.","Biography, Drama, Music"
Kiki's Delivery Service,"A young witch, on her mandatory year of independent life, finds fitting into a new community difficult while she supports herself by running an air courier service.","Animation, Family, Fantasy"
Captain Phillips,"The true story of Captain Richard Phillips and the 2009 hijacking by Somali pirates of the U.S.-flagged MV Maersk Alabama, the first American cargo ship to be hijacked in two hundred years.","Action, Biography, Crime"
Night of the Living Dead,A ragtag group of survivors barricade themselves in an old farmhouse to remain safe from a horde of flesh-eating ghouls that are ravaging the Northeast portion of the United States.,"Horror, Thriller"
Isle of Dogs,"Set in Japan, Isle of Dogs follows a boy's odyssey in search of his lost dog.","Animation, Adventure, Comedy"
Glory,"Robert Gould Shaw leads the U.S. Civil War's first all-black volunteer company, fighting prejudices from both his own Union Army, and the Confederates.","Biography, Drama, History"
Dawn of the Dead,"During an escalating zombie epidemic, two Philadelphia SWAT team members, a traffic reporter and his TV executive girlfriend seek refuge in a secluded shopping mall.","Horror, Thriller"
Awakenings,"The victims of an encephalitis epidemic many years ago have been catatonic ever since, but now a new drug offers the prospect of reviving them.","Biography, Drama"
The World's Fastest Indian,"The story of New Zealander Burt Munro, who spent years rebuilding a 1920 Indian motorcycle, which helped him set the land speed world record at Utah's Bonneville Salt Flats in 1967.","Biography, Drama, Sport"
My Fair Lady,"In 1910s London, snobbish phonetics professor Henry Higgins agrees to a wager that he can make crude flower girl, Eliza Doolittle, presentable in high society.","Drama, Family, Musical"
Frankenstein,Dr Henry Frankenstein is obsessed with assembling a living being from parts of several exhumed corpses.,"Drama, Horror, Sci-Fi"
Thirteen Lives,A rescue mission is assembled in Thailand where a group of young boys and their soccer coach are trapped in a system of underground caves that are flooding.,"Action, Adventure, Biography"
The Insider,A research chemist comes under personal and professional attack when he decides to appear in a 60 Minutes exposé on Big Tobacco.,"Biography, Drama, Thriller"
The Conversation,"A paranoid, secretive surveillance expert has a crisis of conscience when he suspects that the couple he is spying on will be murdered.","Drama, Mystery, Thriller"
Land of Mine,"In post-World War II Denmark, a group of young German POWs are forced to clear a beach of thousands of land mines under the watch of a Danish Sergeant who slowly learns to appreciate their plight.","Drama, History, War"
The Best Offer,A lonely art expert working for a mysterious and reclusive heiress finds not only her art worth examining.,"Crime, Drama, Mystery"
You Can't Take It with You,"The son of a snobbish Wall Street banker becomes engaged to a woman from a good-natured but decidedly eccentric family, not realizing that his father is trying to force her family from their home for a real estate development.","Comedy, Drama, Romance"
Cabaret,A female girlie club entertainer in Weimar Republic era Berlin romances two men while the Nazi Party rises to power around them.,"Drama, Music, Musical"
How to Train Your Dragon 2,"When Hiccup and Toothless discover an ice cave that is home to hundreds of new wild dragons and the mysterious Dragon Rider, the two friends find themselves at the center of a battle to protect the peace.","Animation, Action, Adventure"
Gaslight,"Ten years after her aunt was murdered in their London home, a woman returns from Italy in the 1880s to resume residence with her new husband. His obsessive interest in the home rises from a secret that may require driving his wife insane.","Crime, Drama, Mystery"
Changeling,Grief-stricken mother Christine Collins takes on the L.A.P.D. to her own detriment when they try to pass off an obvious impostor as her missing child.,"Biography, Crime, Drama"
Ed Wood,Ambitious but troubled movie director Edward D. Wood Jr. tries his best to fulfill his dreams despite his lack of talent.,"Biography, Comedy, Drama"
All That Jazz,"Director/choreographer Bob Fosse tells his own life story as he details the sordid career of Joe Gideon, a womanizing, drug-using dancer.","Drama, Music, Musical"
Letters from Iwo Jima,"The story of the battle of Iwo Jima between the United States and Imperial Japan during World War II, as told from the perspective of the Japanese who fought it.","Action, Adventure, Drama"
The Right Stuff,"The U.S. space program's development from the breaking of the sound barrier to selection of the Mercury 7 astronauts, from a group of test pilots with a more seat-of-the-pants approach than the program's more cautious engineers preferred.","Adventure, Biography, Drama"
The Day the Earth Stood Still,"An alien lands in Washington, D.C. and tells the people of Earth that they must live peacefully or be destroyed as a danger to other planets.","Drama, Sci-Fi"
The Outlaw Josey Wales,Missouri farmer Josey Wales joins a Confederate guerrilla unit and winds up on the run from the Union soldiers who murdered his family.,Western
Kramer vs. Kramer,"After his wife leaves him, a work-obsessed Manhattan advertising executive is forced to learn long-neglected parenting skills, but a heated custody battle over the couple's young son deepens the wounds left by the separation.",Drama
Hannah and Her Sisters,"Between two Thanksgivings two years apart, Hannah's husband falls in love with her sister Lee, while her hypochondriac ex-husband rekindles his relationship with her sister Holly.","Comedy, Drama"
The Bride of Frankenstein,"Mary Shelley reveals the main characters of her novel survived: Dr. Frankenstein, goaded by an even madder scientist, builds his monster a mate.","Drama, Horror, Sci-Fi"
The Day of the Jackal,"In the aftermath of France allowing Algeria's independence, a group of resentful military veterans hire a professional assassin codenamed ""Jackal"" to kill President Charles de Gaulle.","Crime, Drama, Thriller"
Days of Heaven,A hot-tempered farm laborer convinces the woman he loves to marry their rich but dying boss so that they can have a claim to his fortune.,"Drama, Romance"
Loving Vincent,"In a story depicted in oil painted animation, a young man comes to the last hometown of painter Vincent van Gogh to deliver the troubled artist's final letter and ends up investigating his final days there.","Animation, Drama, Mystery"
October Sky,"The true story of Homer Hickam, a coal miner's son who was inspired by the first Sputnik launch to take up rocketry against his father's wishes.","Biography, Drama, Family"
Once,"A modern-day musical about a busker and an immigrant and their eventful week in Dublin, as they write, rehearse and record songs that tell their love story.","Drama, Music, Romance"
"Aguirre, the Wrath of God","In the 16th century, the ruthless and insane Don Lope de Aguirre leads a Spanish expedition in search of El Dorado.","Action, Adventure, Biography"
Manhattan,The life of a divorced television writer dating a teenage girl is further complicated when he falls in love with his best friend's mistress.,"Comedy, Drama, Romance"
Breaking the Waves,"Oilman Jan is paralyzed in an accident. His wife, who prayed for his return, feels guilty; even more, when Jan urges her to have sex with another.",Drama
Whisper of the Heart,"A love story between a girl who loves reading books, and a boy who has previously checked out all of the library books she chooses.","Animation, Drama, Family"
Lilya 4-Ever,"Sixteen-year-old Lilja and her only friend, the young boy Volodja, live in Russia, fantasizing about a better life. One day, Lilja falls in love with Andrej, who is going to Sweden, and invites Lilja to come along and start a new life.","Crime, Drama"
Guess Who's Coming to Dinner,A couple's attitudes are challenged when their daughter introduces them to her African-American fiancé.,"Comedy, Drama"
My Left Foot,"Christy Brown, born with cerebral palsy, learns to paint and write with his only controllable limb - his left foot.","Biography, Drama"
Pride,U.K. gay activists work to help miners during their lengthy strike of the National Union of Mineworkers in the summer of 1984.,"Biography, Comedy, Drama"
Stagecoach,A group of people traveling on a stagecoach find their journey complicated by the threat of Geronimo and learn something about each other in the process.,"Adventure, Drama, Western"
The Asphalt Jungle,"A major heist goes off as planned, but then double crosses, bad luck and solid police work cause everything to unravel.","Crime, Drama, Film-Noir"
Duck Soup,"Rufus T. Firefly is named the dictator of bankrupt Freedonia and declares war on neighboring Sylvania over the love of his wealthy backer Mrs. Teasdale, contending with two inept spies who can't seem to keep straight which side they're on.","Comedy, Musical"
The Chaser,A disgraced ex-policeman who runs a small ring of prostitutes finds himself in a race against time when one of his women goes missing.,"Action, Crime, Drama"
The Killer,A disillusioned assassin accepts one last hit in hopes of using his earnings to restore vision to a singer he accidentally blinded.,"Action, Crime, Drama"
Ninja Scroll,A vagabond swordsman is aided by a kunoichi and a spy in battling a demonic clan of killers - led by a ghost from his past - who are bent on overthrowing the Tokugawa Shogunate.,"Animation, Action, Adventure"
East of Eden,"Two brothers in 1910s California struggle to maintain their strict, Bible-toting father's favor as an old secret about their long-absent mother comes to light.",Drama
"I, Daniel Blake","After surviving a heart-attack, a 59-year-old carpenter must fight bureaucratic forces to receive Employment and Support Allowance.",Drama
The Innocents,A young governess for two children becomes convinced that the house and grounds are haunted.,Horror
Red River,"Dunson leads a cattle drive, the culmination of over 14 years of work, to its destination in Missouri. But his tyrannical behavior along the way causes a mutiny, led by his adopted son.","Drama, Western"
The Chorus,The new teacher at a severely administered boys' boarding school works to positively affect the students' lives through music.,"Drama, Music"
All About My Mother,"Pedro Almodovar's Oscar-winning comedy (Best Foreign Film, 1999) about a bereaved mother, and overwrought actress, her jealous lover and a pregnant nun.","Comedy, Drama, Romance"
To Have and Have Not,"During World War II, American expatriate Harry Morgan helps transport a French Resistance leader and his beautiful wife to Martinique while romancing a sensuous lounge singer.","Adventure, Comedy, Film-Noir"
Bringing Up Baby,"While trying to secure a $1 million donation for his museum, a befuddled paleontologist is pursued by a flighty and often irritating heiress and her pet leopard, Baby.",Comedy
The Umbrellas of Cherbourg,A young woman separated from her lover by war faces a life-altering decision.,"Drama, Musical, Romance"
A Prophet,A young Algerian man is sent to a French prison.,"Crime, Drama"
The Man Who Would Be King,"Two former British soldiers in 1880s India decide to set themselves up as Kings in Kafiristan, a land where no white man has set foot since Alexander the Great.","Adventure, War"
The White Ribbon,"Strange events happen in a small village in the north of Germany during the years before World War I, which seem to be ritual punishment. Who is responsible?","Drama, Mystery, Thriller"
Shadow of a Doubt,"A teenage girl, overjoyed when her favorite uncle comes to visit the family in their quiet California town, slowly begins to suspect that he is in fact the ""Merry Widow"" killer sought by the authorities.","Film-Noir, Thriller"
Batman: Mask of the Phantasm,Batman is wrongly implicated in a series of murders of mob bosses actually committed by a new vigilante assassin.,"Animation, Action, Adventure"
Tokyo Godfathers,"On Christmas Eve, three homeless people living on the streets of Tokyo discover a newborn baby among the trash and set out to find its parents.","Animation, Adventure, Comedy"
The Discreet Charm of the Bourgeoisie,"A surreal, virtually plotless series of dreams centered around six middle-class people and their consistently interrupted attempts to have a meal together.",Comedy
His Girl Friday,A newspaper editor uses every trick in the book to keep his ace reporter ex-wife from remarrying.,"Comedy, Drama, Romance"
Cowboy Bebop: The Movie,"A terrorist explosion releases a deadly virus on the masses, and it's up to the bounty-hunting Bebop crew to catch the cold-blooded culprit.","Animation, Action, Crime"
The Lunchbox,A mistaken delivery in Mumbai's famously efficient lunchbox delivery system connects a young housewife to an older man in the dusk of his life as they build a fantasy world together through notes in the lunchbox.,"Drama, Romance"
Hiroshima Mon Amour,A French actress filming an anti-war film in Hiroshima has an affair with a married Japanese architect as they share their differing perspectives on war.,"Drama, Romance"
Crimes and Misdemeanors,An ophthalmologist's mistress threatens to reveal their affair to his wife while a married documentary filmmaker is infatuated with another woman.,"Comedy, Drama"
The Postman,"A simple Italian postman learns to love poetry while delivering mail to a famous poet, and then uses this to woo local beauty Beatrice.","Biography, Comedy, Drama"
"Like Father, Like Son","Ryota is a successful workaholic businessman. When he learns that his biological son was switched with another boy after birth, he faces the difficult decision to choose his true son or the boy he and his wife have raised as their own.",Drama
Once Upon a Time in Anatolia,A group of men set out in search of a dead body in the Anatolian steppes.,"Crime, Drama, Thriller"
Millennium Actress,A TV interviewer and his cameraman meet a former actress and travel through her memories and career.,"Animation, Drama, Fantasy"
Veer Zaara,"""Veer-Zaara"" is a saga of love, separation, courage, and sacrifice. A love story that is an inspiration and will remain a legend forever.","Drama, Family, Musical"
My Life as a Zucchini,"After losing his mother, a young boy is sent to an orphanage with other orphans his age where he begins to learn the meaning of trust and true love.","Animation, Comedy, Drama"
My Life to Live,Twelve episodic tales in the life of a Parisian woman and her slow descent into prostitution.,Drama
Knockin' on Heaven's Door,"Two terminally ill patients escape from a hospital, steal a car and rush towards the sea.","Action, Crime, Comedy"
A Night at the Opera,A sly business manager and the wacky friends of two opera singers in Italy help them achieve success in America while humiliating their stuffy and snobbish enemies.,"Comedy, Music, Musical"
English Vinglish,"A quiet, sweet tempered housewife endures small slights from her well-educated husband and daughter every day because of her inability to speak and understand English.","Comedy, Drama, Family"
Hindi Medium,A couple from Chandni Chowk aspire to give their daughter the best education and thus be a part of and accepted by the elite of Delhi.,"Comedy, Drama"
Vicky Donor,"A man is brought in by an infertility doctor to supply him with his sperm, where he becomes the biggest sperm donor for his clinic.","Comedy, Romance"
John Wick: Chapter 4,"John Wick uncovers a path to defeating The High Table. But before he can earn his freedom, Wick must face off against a new enemy with powerful alliances across the globe and forces that turn old friends into foes.","Action, Crime, Thriller"
Home Alone,"An eight-year-old troublemaker, mistakenly left home alone, must defend his home against a pair of burglars on Christmas eve.","Comedy, Family"
The Whale,"A reclusive, morbidly obese English teacher attempts to reconnect with his estranged teenage daughter.",Drama
Wind River,"A wildlife officer, who is haunted by a tragedy that happened because of him, teams up with an FBI agent in solving a murder of a young woman on a Wyoming Native American reservation and hopes to get redemption from his past regrets.","Crime, Drama, Mystery"
Harry Potter and the Goblet of Fire,"Harry Potter finds himself competing in a hazardous tournament between rival schools of magic, but he is distracted by recurring nightmares.","Adventure, Family, Fantasy"
Halloween,"Fifteen years after murdering his sister on Halloween night 1963, Michael Myers escapes from a mental hospital and returns to the small town of Haddonfield, Illinois to kill again.","Horror, Thriller"
Sicario,An idealistic FBI agent is enlisted by a government task force to aid in the escalating war against drugs at the border area between the U.S. and Mexico.,"Action, Crime, Drama"
The Goonies,A group of young misfits called The Goonies discover an ancient map and set out on an adventure to find a legendary pirate's long-lost treasure.,"Adventure, Comedy, Family"
Zodiac,"Between 1968 and 1983, a San Francisco cartoonist becomes an amateur detective obsessed with tracking down the Zodiac Killer, an unidentified individual who terrorizes Northern California with a killing spree.","Crime, Drama, Mystery"
The Banshees of Inisherin,"Two lifelong friends find themselves at an impasse when one abruptly ends their relationship, with alarming consequences for both of them.","Comedy, Drama"
First Blood,A veteran Green Beret is forced by a cruel Sheriff and his deputies to flee into the mountains and wage an escalating one-man war against his pursuers.,"Action, Adventure, Thriller"
Blue Is the Warmest Colour,"Adèle's life is changed when she meets Emma, a young woman with blue hair, who will allow her to discover desire and to assert herself as a woman and as an adult. In front of others, Adèle grows, seeks herself, loses herself, and ultimately finds herself through love and loss.","Drama, Romance"
Coraline,"An adventurous 11-year-old girl finds another world that is a strangely idealized version of her frustrating home, but it has sinister secrets.","Animation, Drama, Family"
Mission: Impossible - Fallout,"Ethan Hunt and his IMF team, along with some familiar allies, race against time after a mission gone wrong.","Action, Adventure, Thriller"
Aftersun,Sophie reflects on the shared joy and private melancholy of a holiday she took with her father twenty years earlier. Memories real and imagined fill the gaps between as she tries to reconcile the father she knew with the man she didn't...,Drama
Lost in Translation,A faded movie star and a neglected young woman form an unlikely bond after crossing paths in Tokyo.,"Comedy, Drama"
The Hangover,"Three buddies wake up from a bachelor party in Las Vegas, with no memory of the previous night and the bachelor missing. They make their way around the city in order to find their friend before his wedding.",Comedy
Kingsman: The Secret Service,"A spy organisation recruits a promising street kid into the agency's training program, while a global threat emerges from a twisted tech genius.","Action, Adventure, Comedy"
Ocean's Eleven,Danny Ocean and his ten accomplices plan to rob three Las Vegas casinos simultaneously.,"Crime, Thriller"
The Game,"After a wealthy San Francisco banker is given an opportunity to participate in a mysterious game, his life is turned upside down as he begins to question if it might really be a concealed conspiracy to destroy him.","Drama, Mystery, Thriller"
Silver Linings Playbook,"After a stint in a mental institution, former teacher Pat Solitano moves back in with his parents and tries to reconcile with his ex-wife. Things get more challenging when Pat meets Tiffany, a mysterious girl with problems of her own.","Comedy, Drama, Romance"
Black Hawk Down,"The story of 160 elite U.S. soldiers who dropped into Mogadishu in October 1993 to capture two top lieutenants of a renegade warlord, but found themselves in a desperate battle with a large force of heavily armed Somalis.","Action, Drama, History"
Mr. Nobody,"A boy stands on a station platform as a train is about to leave. Should he go with his mother or stay with his father? Infinite possibilities arise from this decision. As long as he doesn't choose, anything is possible.","Drama, Fantasy, Romance"
Harry Potter and the Deathly Hallows: Part 1,"As Harry, Ron and Hermione race against time and evil to destroy the Horcruxes, they uncover the existence of the three most powerful objects in the wizarding world: the Deathly Hallows.","Adventure, Family, Fantasy"
What's Eating Gilbert Grape,A young man in a small Midwestern town struggles to care for his mentally-disabled younger brother and morbidly obese mother while attempting to pursue his own happiness.,Drama
Man on Fire,"In Mexico City, a former CIA operative swears vengeance on those who committed an unspeakable act against the family he was hired to protect.","Action, Crime, Drama"
Training Day,A rookie cop spends his first day as a Los Angeles narcotics officer with a rogue detective who isn't what he appears to be.,"Crime, Drama, Thriller"
Airplane!,"After the crew becomes sick with food poisoning, a neurotic ex-fighter pilot must land a commercial airplane full of passengers safely.",Comedy
When Harry Met Sally...,"Harry and Sally have known each other for years, and are very good friends, but they fear sex would ruin the friendship.","Comedy, Drama, Romance"
The Last of the Mohicans,Three trappers protect the daughters of a British Colonel in the midst of the French and Indian War.,"Action, Adventure, Drama"
Road to Perdition,"A mob enforcer's son in 1930s Illinois witnesses a murder, forcing him and his father to take to the road, and his father down a path of redemption and revenge.","Crime, Drama, Thriller"
Ex Machina,A young programmer is selected to participate in a ground-breaking experiment in synthetic intelligence by evaluating the human qualities of a highly advanced humanoid A.I.,"Drama, Sci-Fi, Thriller"
X-Men: First Class,"In the 1960s, superpowered humans Charles Xavier and Erik Lensherr work together to find others like them, but Erik's vengeful pursuit of an ambitious mutant who ruined his life causes a schism to divide them.","Action, Sci-Fi"
500 Days of Summer,"After being dumped by the girl he believes to be his soulmate, hopeless romantic Tom Hansen reflects on their relationship to try and figure out where things went wrong and how he can win her back.","Comedy, Drama, Romance"
